name,id,desciption,category,buyprice,sellprice,marketvalue,circulation
Anchor ,1250,"Anchors are used to secure seafaring vessels to the seabed when it's time for the captain to go sleepytimes. Small boats tend to use lightweight aluminum anchors weighing under 100lbs, whereas those deployed from large ships are often made from steel and can weigh several tons. If you encounter one of these items during your exploits in Torn City, you should probably work out which one it is before trying to lift it.",Material,$0 ,"$1,500 ","$813,985 ","32,379"
Boat Engine ,1251,"This gasoline-fueled inboard boat engine can produce up to 200 horsepower and has a displacement of 4.5 liters. A model like this is most suited to small to mid-range vessels, but you can also glue a bunch together and use them to power a big boat probably. There's absolutely no scientific reason why this shouldn't work.",Other,$0 ,"$75,500 ","$74,609 ","100,332"
Brass Ingot ,1252,"When a block of zinc and a block of copper love each other very much, they form an alloy known as brass. However, brass can also be acquired directly from the idiom mines, where phrases like ""bold as brass,"" ""the top brass,"" and ""I couldn't give a brass monkeys"" can be carved from the earth, before being melted down and refined. This brass ingot weighs approximately as much as you think it might.",Material,$0 ,$100 ,"$7,117 ","2,067,083"
Tractor Part ,1253,"While tractor owners in the mainland US had to fight tooth and nail to enact right-to-repair laws, Torn's farming community have been fixing their own vehicles for decades - often with disastrous results. This tractor component is generic enough that it can be installed easily by even the most numbskulled amateur mechanic. Just pop open the hood, rip out the bad part, whack in the new thingy, and you're good to go!",Other,$0 ,"$6,500 ","$6,500 ","358,470"
Tire ,1254,"Building upon an ancient concept known as ""the wheel"", the tire is an inflatable rubber covering which sits around the rim of a wheel to make it look pretty. Controversial studies suggest that the addition of tires to wheels provide more grip and stability for the vehicle's driver, but these claims are yet to be proven independently. The modern tire contains over 200 materials, including kevlar, nylon, rubber, and steel. This is why they smell so good when you burn them.",Other,$0 ,$90 ,$724 ,"1,131,902"
Bone Saw ,1255,"Bone saws are a common feature of both butcher's shops and hospital surgeries. This particular saw has a universal tooth design, giving it the power to hack through dense bone while maintaining the precision needed for finer, more delicate cuts. There are, however, several types of bone which are incompatible with this saw, including knucklebones, trombones, Ken Bones, and lazybones.",Melee,$0 ,$800 ,"$17,427 ","107,732"
Machine Part ,1256,"The most important part of a machine is the machine part, which works with other machine parts to form part of a much larger machine. Machine parts can be machined, in part, by machines, which themselves comprise of many different machine parts. Once someone has machined a machine part using the various parts of a machine, many find it hard to part from their machined machine part.",Other,$0 ,"$4,000 ","$3,925 ","1,548,254"
Cattle Prod ,1257,"A cattle prod is an electric powered-device used to persuade livestock to move. Since human to cow conversation is no longer possible, violence is the only way in which farmers are able to communicate their desires to their bovine bretheren. Cattle prods typically impart a low-current shock of 5 milliamps and around 4,000 volts upon their recipient. This device has been modified to transmit up to 100 milliamps and 10,000 volts. Have fun!",Melee,$0 ,"$1,250 ","$909,512 ","30,655"
Binoculars ,1258,"Beloved by birdwatchers and stalkers alike, binoculars enable the user to see far away shit from wherever they are - unless they're behind a wall. Capable of up to 10x magnification, this set of binoculars is ergonomically designed to ensure a lightweight and compact design. They also have a little strap that lets you wear them around your neck.",Tool,$0 ,"$2,000 ","$3,792 ","338,081"
Razor Wire ,1259,"Razor wire is a specific type of barbed wire that contains sharp-edged blades and loops designed to make it even harder for trespassers to interfere with. This is an important distinction that was not referenced in the 1996 superhero movie, Barb Wire, starring Pamela Anderson. Many people blame the movie's failure on this omission, but it is hoped this mistake will be rectified with the forthcoming resurrection of the RWCU (Razor Wire Cinematic Universe.)",Other,$0 ,"$4,325 ","$8,329 ","220,342"
Stamp Collection ,1260,"This wall-mounted stamp collection contains some of the most expensive postage marks the world has to offer. The Inverted Jenny, Red Mercury, and Bordeaux Cover are just some of the rare and valuable stamps not included in this reasonably priced collection. However, there are still plenty of desirable letter-enablers within this display, including a rare British stamp from 1982 which depicts a cartoon version of Diana, Princess of Wales giving birth to Prince William.",Other,$0 ,"$30,000 ","$93,543 ","28,638"
Bucket ,1261,"There is nothing to be said about the humble bucket that hasn't been said before. From water to wet cement, this receptacle will take your loads without question. As buckets go, this one is top of the range, having been built from high-density polyethylene and capable of holding up to six gallons. You can double that amount by adding an extra bucket to your repertoire.",Tool,$0 ,$20 ,$733 ,"1,086,428"
Urea ,1262,"Urea, also known as carbamide, is a naturally occurring substance that can be found in the waste products of many biological organisms. Within the human body, urea is synthesized in the liver, filtered from your blood via the kidneys, and then expelled through urination. In Torn City, urea can only be found in little plastic tubs - you cannot farm it by collecting your piss.",Other,$0 ,$500 ,"$7,350 ","513,407"
Phosphorus ,1263,"If you were to blend salmon, pork, parmesan cheese, brazil nuts, and pumpkin seeds, you'd create a disgusting fishy little pig patty that was incredibly high in phosphorous. Within biological organisms, phosphorous is involved in the formation of DNA, among other things. Outside of meaty flesh-bags, phosphorous is an important ingredient in fertilizers, matches, and pyrotechnics. Without this chemical element, you wouldn't be able to enjoy a smoke during a Rammstein concert while eating a home-grown tomato.",Other,$0 ,$300 ,"$17,060 ","339,082"
Potassium Nitrate ,1264,"Try buying a kilo of potassium online, and the feds will think you've gone bananas. Buy a kilo of potassium nitrate, and they'll assume you're halfway through writing your own manifesto. Also known as saltpeter, this crystalline salt acts as the oxidizing agent in gunpowder. On its own, it's about as dangerous as table salt. Mix it with fuel and you'll get something dangerously volatile that makes a fire burn hotter than the inside of a McDonald's apple pie.",Other,$0 ,$700 ,"$17,423 ","1,041,860"
Grain ,1265,"A 50 kilogram sack of premium quality grain containing a blend of genetically modified strains selected for their durability and nutritional value. Not only do these strains survive better than their counterparts, they are engineered to overwhelm native species and dominate all available arable land. In a few years time, this grain will be the only strain on planet Earth!",Other,$0 ,$150 ,"$1,949 ","432,900"
Shampoo ,1266,"In a world where every bathroom product is an 8-in-1 combination of face wash, moisturizer, and engine degreaser, this 500ml bottle of plain old shampoo is a refreshing callback to a simpler time. The shampoo contained within will not make your hair volumnous or luscious, nor will it make any of it grow back. All it does is clean the shit from your hair. And really, isn't that enough?",Other,$0 ,$20 ,$252 ,"806,446"
Detergent ,1267,"Sick of stained clothes making you look like a grubby little bastard? This all-in-one ultra force extreme clean power wash turbo turbo mega cleanse miracle detergent is the product for the job. Just one capful of this laundry liquid will see your clothes rinsed of dirt, oils, and human DNA! 8 out of 5 housewives don't disagree!",Other,$0 ,$35 ,"$1,023 ","298,769"
Vitamins ,1268,"Feeling a little run-down? Is the daily drudgery of commuting and working taking its toll? This bottle of 120 multivitamins will do absolutely nothing to help! With each pill containing 150% more than the recommended daily dose of 22 vitamins and minerals, you're guaranteed to piss out far more than you absorb! Now with extra bulking agents!",Other,$0 ,$50 ,$251 ,"1,758,284"
Cough Syrup ,1269,"Originally formulated as a remedy for throat irritation and congestion, cough syrup became popular among Houston's blues musicians in the 1960s as a potent mixer for beer. Known on the streets as Purple Drank, Sizzurp, and Lean, codeine-laced Cough Syrup is now enjoyed straight by modern artists like Lil Wayne and Engelbert Humperdinck.",Other,$0 ,$30 ,$611 ,"2,955,073"
Paper Towels ,1270,"A roll of ultra-absorbent, perforated sheets designed to help you mop up spills, splatters, and spooge with ease. Because there are some jobs where a wad of toilet paper just isn't enough.",Material,$0 ,$10 ,"$15,893 ","1,764,862"
Pepper Mill ,1271,"Tired of crushing whole peppercorns between your teeth before spitting the peppery paste onto your food? This pepper mill takes the effort out of seasoning your lunch by grinding peppercorns into dust with just a few twists of the knob! With its adjustable grinding mechanism, you can pick from coarse, extra coarse, and not at all coarse to suit your tastes. Don't chew whole peppercorns like a fruitcake. Use a pepper mill!",Other,$0 ,$95 ,$0 ,0
Toothbrush ,1272,"What do teeth and hair have in common? They both contain keratin, grow out of your face, and require regular brushing to prevent you from looking gross. Regular brushing with a toothbrush helps maintain the health and appearance of your teeth, while also giving you something to do while you stare at your reflection each morning.",Other,$0 ,$5 ,"$1,933 ","364,927"
Toothpaste ,1273,"This brand of toothpaste is one of the few dental products on the market that is not recommended by 9 out of 10 dentists. Its unique formula contains activated uranium to help strengthen and protect enamel, while the lead microparticles help to gently erase stains and plaque from the surface of your teeth. Available in three refreshing flavors: Spearmint, New Car, and Flamin' Hot Nacho Cheese.",Other,$0 ,$5 ,$806 ,"284,887"
Mouthwash ,1274,"Mouthwash is a crucial addition to your oral hygiene regimen. With a quick swish around the gums, mouthwash can kill germs and bacteria, prevent gum disease, and replace the disgusting taste of minty toothpaste with a fresh dose of even mintier liquid. Many modern mouthwashes are made alcohol-free to cater to those of a religious persuasion. This particular mouthwash contains more alcohol than is necessary. Using this formula to rinse out your mouth will put you four times over the legal driving limit.",Other,$0 ,$10 ,$259 ,"761,015"
Mop ,1275,"This microfiber mop is able to trap dirt and bacteria much more efficiently than sponge or string mops. Its replaceable and washable head means you could and possibly should have a separate one for each room! Because you wouldn't want to clean your kitchen with the same head you've used in the bathroom, would you? No seriously, would you?",Other,$0 ,$20 ,"$1,499 ","152,361"
Broom ,1276,"Often found wedged between the thighs of sky-dwelling female sorcerers, the broom is an essential part of every household's cleaning apparatus. Most useful for redistributing dust and shards of glass into that bit beneath the fridge, brooms are never to be used to clean up a wet mess. In fact, if you look closely at the base of the handle, you'll see the words ""No wet messes"" inscribed into each and every broom that has ever been produced. Don't believe us, go and look for yourself!",Other,$0 ,$20 ,"$1,288 ","169,748"
Floor Cleaner ,1277,"A wise man once said that anything can be a floor cleaner if you use it to clean the floor. This is true, but alas, this so-called wise man also decided to mix all of the stuff under his sink when he ran out of floor cleaner. He ended up with a severe headache and a really clean floor. Let this be a lesson to you all. Always buy floor cleaner.",Other,$0 ,$35 ,$517 ,"699,045"
Model Spine ,1278,"This anatomically accurate representation of the human spinal column is so realistic it's hard to believe that it wasn't ripped out of an actual person's back one dark night last April. But it wasn't, and there's absolutely nothing you can do to prove otherwise. All of the major back bits are in here, with the cervical spine at the top, the lumbar at the bottom, and the classic thoracic spine located in the middle. You could use this model spine to demonstrate many things, such as how to lift a box correctly, the best way to get into various limbo positions, or as a prop to taunt cowards and worms.",Other,$0 ,"$4,000 ","$10,154 ","65,395"
Massage Table ,1279,"Proper massage is a sacred art form, as when correctly performed, it involves the careful rubbing of a human body in such a way that it is pleasurable and relaxing without becoming arousing. This foldaway table allows you to practice massage in the comfort of your own home or those of your clients. And if your patient should become involuntarily aroused, the table's handy carry case enables you to make a swift getaway!",Other,$0 ,"$1,900 ","$15,892 ","77,723"
Scalp Massager ,1280,"Quad-pronged for your pleasure, this scalp massager is guaranteed to send the wearer off into orgasmic bliss after just 30 seconds of use. Each prong is adjustable, allowing even those with a considerable-sized noggin to enjoy a relaxing head rub. The accompanying instruction manual suggests that you shouldn't use this device while driving or operating heavy machinery. But what they don't know won't hurt them!",Other,$0 ,$700 ,$722 ,"222,860"
Dentures ,1281,"Also known as false teeth, dentures act as a replacement for the wearer's natural teeth if they have been lost due to decay, violence, or the fact that you're a young bride in Victorian Britain. Fixed using suction to the upper and lower parts of the mouth, dentures help to restore chewing abilities to the wearer, while also helping them to speak and smile. The earliest dentures were constructed from full-sized whale teeth of up to 8 inches in length, causing the wearer to look quite preposterous indeed. This is where the saying ""long in the tooth"" originates from.",Other,$0 ,"$2,200 ","$2,379 ","137,669"
Gold Tooth ,1282,"This golden dental crown is an 18 carat prosthesis that can be fitted comfortably to whatever remains of your existing tooth. Gold is an excellent substance to use in the mouth due to its durability and low likelihood of causing an allergic reaction. However, most people choose this material for its aesthetic value, despite the fact that gold teeth make you look like a poor person who won the lottery.",Other,$0 ,$400 ,"$16,708 ","1,217,292"
Bleaching Tray ,1283,"Are your teeth discolored from drinking nothing but Gatorade and piping hot gravy? This reusable bleaching tray can help restore the natural whiteness of your smile. To begin, dunk the tray in hot water, before fixing it to your maxillary or mandibular arch. Once the tray has molded to the shape of your teeth, you may remove it and fill the tray with bleach. Any kind of bleach will do, including hair, industrial strength, and the kind you'd find under mom's sink! Once you've lined the tray with your bleaching agent of choice, simply wear it overnight and you'll wake up the next morning with a mouth full of pearly whites!",Other,$0 ,$200 ,"$1,617 ","158,794"
Dental Mirror ,1284,"Comprising a compact mirror attached to a thin, stainless steel handle, this dental mirror can help you figure out precisely where that awful stench is coming from. Whether it's a rotten tooth or a trapped bit of gristle wedged inside your tonsil cavity, this lightweight, 15cm dental mirror will help you find it.",Tool,$0 ,$150 ,"$44,916 ","91,967"
Paperclips ,1285,"Do you have a job that requires precisely 501 paperclips? Then this tub of 500 paperclips is almost exactly what you need. Crafted from reasonable-quality metal, these paperclips are 99% guaranteed to fix any two pieces of paper or thin card together. Thick card? Probably not. Heavy-duty plastic wallets? Probably not. Sheet metal? Go f**k yourself. But card and paper, that's never a problem for these almost halfway decent metal fastener things.",Other,$0 ,$15 ,"$13,056 ","127,987"
Stapler ,1286,"Have you temporarily fixed two pieces of paper together with a paperclip? Are you ready to affirm your commitment to said union with a declaration of marriage? Then use a stapler to wed those items for now and evermore. This stapler can hold a mighty 210 individual staples, but since you'll probably lose most of those to errors and staple attacks against your co-workers, a full capacity stapler can probably join around 10-20 documents at most.",Other,$0 ,$20 ,$888 ,"332,788"
Hole Punch ,1287,"The ability to create thousands upon thousands of tiny circles of paper was once but a pipe dream for mankind. Until, that is, the hole punch was invented, allowing humanity to finally achieve its dream of making holes in things. Interestingly, the ring binder was invented before the hole punch, with clerks and filing assistants forced to chew their own holes in paper during the interim.",Other,$0 ,$30 ,"$2,584 ","178,610"
Notepad ,1288,"160 pages of 80GSM paper hand-lined by a Madagascan virgin. Bound using fine quality aluminium rings, each lightly-perforated page tears off with the delicate grace of a ballerina made of feathers. Taking notes in this notepad is like blowing your nose with silk.",Other,$0 ,$10 ,$219 ,"1,613,474"
Permanent Marker ,1289,"Known to produce a brief yet satisfying high when sniffed, permanent markers are sometimes used for drawing on things too. The permanent nature of these markers means that the most satisfying object to deface is by far the humble whiteboard. Upon seeing your scrawls, the owner will undoubtedly assume that they were made using the correct apparatus - a whiteboard marker. Alas, when they come to remove your artwork using a whiteboard eraser, they shall be thwarted.",Tool,$0 ,$50 ,"$2,766 ","486,224"
Toner ,1290,"During the 20th century, it was predicted that the wars of the future would be fought over natural resources such as water. As we push on through the third millennium, it has become clear that valuable commodities such as printer toner will be the driver of most major conflicts. Nobody knows what the ink in these sacred cartridges is made of, but given their exorbitant price it must be something rare. This particular cartridge is of a versatile design that allows it to be used in printers, fax machines, and any other device our writer deems realistic at the time.",Material,$800 ,$0 ,$485 ,"5,073,442"
Bloody Apron ,1291,"As opposed to a regular apron, a bloody apron is an apron that's covered in blood. In this instance, the blood belongs to a combination of various animals, including cows, pigs, chickens, elephants, cats, dogs, and mongeese, in addition to a small trace of human blood too. This apron is undoubtedly a scary piece of attire, and would not look out of place at a Halloween party or as casualwear during a light lunch at Elizabeth Báthory's house.",Clothing,$0 ,$5 ,"$2,574,998 ","21,281"
Bone ,1292,"Bones are the natural framework on which the meatier parts of biological beings are draped. Primarily consisting of collagen fibers and mineralized calcium, the collective noun for a group of bones is a spooky skeleton. This particular bone is of unknown origin - it could even be yours!",Other,$0 ,$0 ,"$9,389 ","1,040,830"
Injury Cache ,1293,"Have you had an accident in the last five years that wasn't your fault? Arrive at the trial wearing an item from the Injury Cache, and you could increase your payout by over 500%!!! Bandages, braces, and prostheses can be found in this box of medical-themed wearables, with most items left bloody and unwashed so as to retain the unique musk of human misery.",Supply Pack,$0 ,$0 ,"$4,415,887 ","10,930"
Glitter Bomb ,1294,"A recent poll listed glitter as the second-most annoying substance known to mankind, behind old milk but ahead of uranium. This Glitter Bomb can be used to deploy shiny dirt into every crease and crevice of your opponent, either as a sign of affection, or a display of malicious intent. The glitter in this Glitter Bomb was made from recycled DVD covers produced for Mariah Carey’s 2001 movie Glitter, which bombed at the box office.",Temporary,$0 ,$0 ,"$94,322 ","123,566"
Hell Priest Mask '22 ,1295,"Known to many as Pinhead, the Hell Priest is both the leader of The Cenobites and an important figure in the modern identity politics movement, as he identifies as neither an angel nor a demon. In tribute to the character's sadomasochistic persuasion, this mask of the Hell Priest was created with the sharp ends of the pins turned inwards - pain has a face, allow us to show it to you.",Clothing,$0 ,$0 ,$0 ,250
Ban Hammer ,1296,"The mythical Ban Hammer wielded by staff against unruly citizens has now become manifest. All hail its unrivaled ability to defeat cheaters and perverts through the power of federal jailing. Bow before its might. Fear its judgement. Loathe it. Love it. Kiss it as if it were your mother. For if you step out of line, even just once, the Ban Hammer shall be brought down upon you with the full force of Federal Law.",Melee,$0 ,$0 ,$0 ,45
Donkey Adoption Certificate ,1297,"Alan is a 14-year-old retired beach donkey who lives on an island sanctuary off the south coast of Torn City. This Donkey Adoption Certificate confirms that someone has paid on your behalf to cover the cost of Alan's care for the foreseeable future. In return, the bearer of this certificate will receive regular updates on Alan's health, general demeanor, and frequent romantic encounters.",Collectible,$0 ,$0 ,$0 ,998
Tin of Treats ,1298,"Looking to indulge your sweet tooth? Then pop open this Tin of Treats and feast upon the sugary goodness inside. Each tin contains six random candies, including Jawbreakers, Pixie Sticks, Candy Kisses, Tootsie Rolls, Chocolate Truffles, and Sherbet. And if your favorite pet has just died, or your partner has left you for a younger lover, nobody could judge you for shoving the whole lot right in your miserable gob.",Supply Pack,$0 ,$0 ,"$1,305,306 ","65,287"
Queen Elizabeth II Mask '22 ,1299,"In some cultures, the creation of a death mask is considered a sign of respect - that's our excuse, and we're sticking with it. This Queen Elizabeth II mask, created to honor the second-longest reigning Monarch in history, is made from recycled Union Flags and copies of the Daily Express. It is your divine right to wear this mask on any occasion you see fit, whether you're cutting the ribbon on a new sewage works, orchestrating the death of your daughter-in-law, or visiting a local branch of Coutts to pay off your son's considerable legal bills.",Clothing,$0 ,$0 ,$0 ,250
eCPU ,1300,"The ultra-efficient eCPU is very much like an afternoon at grandma's house or a typical British summer - there's no chance of things getting hot. This type of processor is your best bet if you're looking for a low-power, low-heat build. An eCPU-focused rig might not register a particularly high MIPS rate, but nor will it turn your apartment into an oven while it's running.",Tool,$0 ,$255 ,$398 ,"3,062,397"
CPU ,1301,"A Central Processing Unit is a microchip, typically silicon-based, that acts as the primary processing component of a computer. Consisting of millions and sometimes billions of transistors, the CPU is often referred to as the brain of a computer. This makes you wonder which part is the anus. Probably the cooling fan.",Tool,$0 ,$180 ,$376 ,"11,344,608"
HPCPU ,1302,"Moore's law is the observation that the number of transistors in an integrated circuit (IC) doubles about every two years. This high-performance chip follows that trend by improving on the millions and billions of transistors integrated into a typical CPU by an order of squillions. When running at full capacity, this HPCPU gets hot enough to cook an egg - albeit a really tiny one from like a midget bird or something.",Tool,$0 ,$0 ,"$55,014 ","602,748"
Computer Fan ,1303,"Known as the anus of the PC, the computer fan is a mechanical device used to draw air away from the components within. A brief inspection of your own computer fan will almost certainly reveal a thick layer of dust that has built up over months or possibly years, depending how gross you are. This dust can be consumed to produce a special ""coughing"" effect.",Tool,$0 ,$20 ,"$1,097 ","4,179,497"
Water Block ,1304,"Made from copper or aluminum, a water block consists of a metal cube which contains numerous internal channels filled with coolant. When placed next to high-temperature components, a water block can help to improve computer performance by absorbing heat and distributing it elsewhere. This is in stark contrast to laptops, which simply redistribute heat from within the system to your thighs and groin.",Tool,$0 ,$0 ,"$3,649 ","526,275"
