name,id,desciption,category,buyprice,sellprice,marketvalue,circulation
Scalpel ,846,"This surgical scalpel boasts a blade that is crafted from volcanic glass, far surpassing the sharpness of conventional steel. Its ultra-fine edge glides effortlessly through flesh, enabling precision cuts at a cellular level. Perfect for crafting the most intricate of details, this scalpel is an indispensable tool for forgers and mutilators alike.",Melee,$0 ,$0 ,"$1,644 ","45,355"
Nerve Gas ,847,"Odorless, colourless and extremely potent, Sarin Nerve gas paralyses the lung muscles to cause death from suffocation within one to ten minutes after inhalation.",Temporary,$0 ,$0 ,$0 ,11
Kevlar Lab Coat ,848,"This laboratory coat consists of a Kevlar polymer reinforced with carbon-fiber and overlaid with fire-resistant Nomex. Knives, bullets and flames will have a hard time penetrating this piece of apparel.",Defensive,$0 ,$0 ,$0 ,0
Loupes ,849,"Whether you're performing life-saving surgery or an agonising vivisection procedure, these head-mounted medical loupes allow you to magnify your view of the subject and make incisions with precision.",Clothing,$0 ,$0 ,$0 ,0
Sledgehammer ,850,"The 40lb Sledgehammer is a difficult weapon to wield. But if you do manage to connect with your opponent, a single blow is often enough to pulverize their pelvis into dust. Incidentally, that's why Peter Gabriel chose this as his nickname.",Melee,$0 ,$0 ,"$340,000,000 ",177
Wifebeater ,851,"Whenever someone rocks up to a fight wearing a vest, you know they're gonna be able to take a punch. There's just something about the wifebeater vest that makes you harder to put down. Don't believe us, try it for yourself!",Clothing,$0 ,$0 ,$0 ,0
Metal Detector ,852,"Most frequently found in the hands of lonely middle-aged men with nothing better to do on a Sunday, the metal detector is a handheld device capable of locating metallic objects through sand, soil and human flesh.",Tool,$0 ,$0 ,"$3,653,861 ","70,424"
Cemetery Key ,853,"As its name suggests, this key grants access to the Torn City cemetery, enabling you to desecrate graves, interfere with corpses and make goth music videos as often as you so wish.",Tool,$0 ,$0 ,"$4,318,462 ","58,426"
Questionnaire : Completed ,854,"The Neurological Uniform Temperament Survey is a form containing probing psychological questions, the answers to which can be used to determine the subject's proclivities for violence, empathy and general shenanigans.",Other,$0 ,$0 ,$0 ,4
Agreement : Signed ,855,"The Casus Foederis is a legal document created on behalf of Professor Amanda Ravenscroft. The signing of this document allows for your continued employment by the Professor, but you would be wise to read its terms before you do so.",Other,$0 ,$0 ,$0 ,1
Spray Paint : Black ,856,"This aerosol can contains approximately 400ml of black spray paint. The black items displayed on the can include a chalkboard, some coal, a blackbird, and the darkened void of your immediate surroundings after being locked in the cellar and fed nothing but pins.",Material,$10 ,$5 ,$557 ,"3,242,846"
Spray Paint : Red ,857,"This aerosol can contains approximately 400ml of red spray paint. The red items displayed on the can include a tomato, a firetruck, a stop sign, and the blood-spattered victims of a brutal murder suicide.",Material,$10 ,$5 ,$531 ,"2,953,243"
Spray Paint : Pink ,858,"This aerosol can contains approximately 400ml of pink spray paint. The pink items displayed on the can include a piglet, cotton candy, flamingoes, and a sunburnt version of the singer Alecia Beth Moore Hart.",Material,$10 ,$5 ,$556 ,"2,418,211"
Spray Paint : Purple ,859,"This aerosol can contains approximately 400ml of purple spray paint. The purple items displayed on the can include grapes, an eggplant, some pansies, and a really big bruise that looks like it'll be sore tomorrow.",Material,$10 ,$5 ,$584 ,"2,229,187"
Spray Paint : Blue ,860,"This aerosol can contains approximately 400ml of blue spray paint. The blue items displayed on the can include blueberries, the ocean, a bunch of cornflowers, and a waffle.",Material,$10 ,$5 ,$512 ,"2,568,813"
Spray Paint : Green ,861,"This aerosol can contains approximately 400ml of green spray paint. The green items displayed on the can include a frog, a patch of grass, a cannabis leaf, and a tubby child's face after riding a rollercoaster.",Material,$10 ,$5 ,$544 ,"2,352,937"
Spray Paint : White ,862,"This aerosol can contains approximately 400ml of white spray paint. The white items displayed on the can include a sheet of A4 paper, a snowflake, cotton wool, and a spooky-gentleman dressed like some kind of pointy ghost.",Material,$10 ,$5 ,$520 ,"2,921,875"
Spray Paint : Orange ,863,"This aerosol can contains approximately 400ml of orange spray paint. The orange items displayed on the can include a satsuma, cheetos, a kinky drawing of Garfield, and the Pornhub logo stencilled onto Donald Trump's face.",Material,$10 ,$5 ,$654 ,"1,707,683"
Salt Shaker ,864,"The Salt Shaker is similar to a pepper shaker, in so much as it is a shaker full of salt, rather than pepper. You may wish to send it to someone who frequently dispenses excess sodium within the forums.",Other,$0 ,$5 ,"$31,330 ","133,969"
Poison Mistletoe ,865,"The quickest route to pleasure is through someone else's misery. If 2017 had a slogan, that would be it. So why not ring out the year by smooching under this Poison Mistletoe, which contains a hidden spritzer allowing you to drench your beloved in toxic chemicals and gain happiness at their expense.",Special,$0 ,$0 ,"$67,519,925 ","13,974"
Santa's List '17 ,866,"Have you been naughty or nice in 2017? This list was stolen from Santa's grotto and contains the names of all Torn's citizens neatly separated into two, highly judgemental columns. Those with split personality disorders are deemed eligible for both.",Collectible,$0 ,$0 ,$0 ,100
Soapbox ,867,"Have you got something mean to say about staff or Chedburn? Perhaps you're leaving the game due to a recent change and you'd like everyone to stand up and notice. If so, you'll need a portable pontification podium from which to preach your wisdom. Feel free to pass on the Soapbox to those who need it most.",Collectible,$0 ,$0 ,$0 ,25
Turkey Baster ,868,"The favoured tool of same sex and surrogate parents, this turkey baster can be employed to assist in the impregnation of a human woman without resorting to formal intercourse. It may also be used to slather a piece of cooked meat in its own juices - after you've rinsed it out.",Other,$0 ,$1 ,"$6,489 ","276,510"
Elon Musk Mask '17 ,869,"The fragrantly-named Elon Musk poses a threat to humanity like no man before. A potential super-villain in the making, his artificially intelligent bidets and hyperscoop payment pals will destroy us all. Amber Heard found this out for herself, so please, raise awareness of Musk's evil intentions by sporting this mask of his face. Just like Space X rockets, this mask is reusable and may explode upon impact.",Clothing,$0 ,$0 ,$0 ,250
Love Juice ,870,"Made from the secretions of the Patagonian Filth Weasel, Love Juice is a fast acting aphrodisiac - or so it says on the label. In reality, this product is known to be useless, unless you are exposed to a large cloud of human reproductive pheromones, in which case it will make you angry, hyperactive and strangely Samaritan.",Drug,$0 ,$0 ,"$3,036,416 ","123,063"
Bug Swatter ,871,This bug swatter is given to those who report serious exploits or bugs which they could have abused for their own gain. The number of these items in circulation gives a good idea of how honest citizens really are.,Melee,$0 ,$0 ,$0 ,40
Nothing ,872,"Following the results of a city-wide poll, the people of Torn decided that the first 100 people to reach Level 100 should be given nothing. So here it is. Absolutely diddly squat. Zilch. Nada. Nowt.",Collectible,$0 ,$0 ,$0 ,100
Bottle of Green Stout ,873,"Consisting of nothing more than a glug of Irish stout and copious amounts of toxic green food colouring, this emerald-coloured beverage will give you the supreme confidence of a drunk while also serving to clean out your colon in record time. Provides a very large nerve increase when consumed.",Alcohol,$0 ,$0 ,"$1,013,726 ","120,311"
Prototype ,874,"A weapon provisionally delegated by Torn authorities to members of the staff and committee for the experimentation of special bonuses. The firearm should be kept in optimal condition and cleaned regularly during entrustment, may be repossessed at any time.",Secondary,$0 ,$0 ,$0 ,75
Rotten Apple ,875,"A withered apple. It's puckered skin is spotted with age. Shaking the apple stirs a faint rattling, as dried seeds echo within its woody core.",Other,$0 ,$0 ,$414 ,"1,474,269"
Festering Chicken ,876,"A decaying chicken drumstick half covered in dried ranch dressing. Despite its rancid aroma, it is considered a delicacy by much of Torn City's animal population.",Other,$0 ,$0 ,$685 ,"396,384"
Moldy Pizza ,877,A putrid slice of pizza adorned with mushrooms of dubious origin. Sniffing it very carefully reveals the faintest odour of anchovies.,Other,$0 ,$0 ,$698 ,"348,060"
Smelly Cheese ,878,"A rancid slice of cheese garnished with gobs of spoiled mayonnaise. Left out in the sun too long, it oozes grease.",Other,$0 ,$0 ,"$6,978 ","296,207"
Sour Milk ,879,A grubby bottle of spoiled milk. The glass is smeared with greasy fingerprints and the contents are dried and lumpy. It is not a good idea to smell this item.,Other,$0 ,$0 ,"$3,016 ","210,901"
Stale Bread ,880,"A piece of dry bread. Once part of a sandwich, now it is home to a collection of molds.",Other,$0 ,$0 ,"$6,592 ","178,658"
Spoiled Fish ,881,"A fetid piece of fish, half rotted, then dried in the midday sun. In some places this might be considered a local delicacy. Torn City is not one of them.",Other,$0 ,$0 ,"$3,090 ","143,193"
Insurance Policy ,882,"A fully customizable insurance policy with blanks in both standard and non-standard places. It can be used to insure anything and everyone, with or without their knowledge.",Material,$0 ,$1 ,"$17,686 ","657,604"
Bank Statement ,883,"A bank statement bearing the name, address and account number of someone unfortunate with money to steal.",Material,$0 ,$1 ,"$25,027 ","895,491"
Car Battery ,884,A fully charged car battery.,Other,$0 ,$450 ,$500 ,"3,349,162"
Scrap Metal ,885,A useful-looking piece of scrap metal. This item can be sold for cash or put to a number of innovative and profitable uses.,Other,$0 ,$50 ,$274 ,"10,740,837"
Torn City Times ,886,"Read all about Torn's most dangerous criminals in the city's only officially recognized newspaper! The Torn City Times: Bringing you the biggest, realest, newest news.",Tool,$0 ,$0 ,"$9,723 ","550,367"
Magazine ,887,"Karma! Magazine: Exposing the looks, loves and dirty laundry of Torn's hottest criminals.",Other,$0 ,$5 ,$607 ,"1,556,498"
Umbrella ,888,This convenient travel umbrella comes with a telescopic handle and absolutely no guarantees.,Other,$0 ,$75 ,$232 ,"1,346,721"
Travel Mug ,889,A leak-proof travel mug that makes it easier to beat people up without spilling your coffee.,Other,$0 ,$30 ,$323 ,"1,197,694"
Headphones ,890,Block out the sound of danger with these stylish headphones! Disclaimer: danger may persist despite silence.,Other,$0 ,$250 ,$226 ,"2,063,375"
Undefined ,891,,Unused,$0 ,$30 ,$0 ,0
Mix CD ,892,A home-made CD featuring a romantic hand-picked playlist.,Other,$0 ,$5 ,$268 ,"758,864"
Lost and Found Office Key ,893,This key opens the door to the Subway Lost and Found office.,Tool,$0 ,$0 ,"$284,989 ","43,182"
Cosmetics Case ,894,A high quality cosmetics case filled with designer makeup and high quality applicators.,Other,$0 ,$200 ,$201 ,"1,827,318"
Phone Card ,895,"This long distance phone card is great for catching up with friends, threatening your enemies, and lying to parole officers.",Other,$0 ,$30 ,$242 ,"1,080,438"
Subway Pass ,896,Get through turnstiles faster with a season pass for the Torn City subway.,Other,$0 ,"$2,000 ","$1,952 ","539,395"
Bottle Cap ,897,The apocalypse is inevitable. Invest in the currency of the future by collecting bottle caps!,Other,$0 ,$1 ,"$1,038 ","49,338,211"
Silver Coin ,898,An old American silver dollar polished by the sands of time.,Other,$0 ,"$10,000 ","$31,262 ","477,338"
Silver Bead ,899,A native american silver bead decorated with an intricate pattern.,Other,$0 ,"$25,000 ","$367,260 ","52,389"
Lucky Quarter ,900,This lucky quarter will give you a heads' up whenever you need it!,Other,$0 ,"$5,000 ","$433,993 ","41,625"
Daffodil ,901,A bright and cheerful yellow flower certain to fill you with the joys of spring.,Flower,$0 ,$5 ,$234 ,"2,423,137"
Bunch of Carnations ,902,An inexpensive yet stylish bunch of flowers from a gas station near you! Perfect for apologising to your wife or taking to the funeral of a colleague you didn't really like.,Flower,$0 ,$15 ,$234 ,"2,600,695"
White Lily ,903,Pay your respects with this flawless white lily. May leave pollen on your clothing.,Flower,$0 ,$10 ,"$5,318 ","700,651"
Funeral Wreath ,904,Send your enemies off in style with this tasteful funeral wreath!,Flower,$0 ,$75 ,$283 ,"1,639,266"
Car Keys ,905,"These mystery car keys are missing their fob, but they might still turn out to be useful.",Other,$0 ,$100 ,"$1,135 ","2,208,225"
Handkerchief ,906,"A delicately embroidered handkerchief, perfect for drying tears.",Tool,$0 ,$10 ,$467 ,"1,453,319"
Candle ,907,A sturdy ten inch candle suitable for a variety of uses.,Material,$0 ,$10 ,"$1,932 ","3,713,572"
Paper Bag ,908,"Awarded to the winners of Leslie's 'I Hate Mr and Ms Torn' contest, this paper bag can be worn over the head to protect others from the soul-destroying horror that is your damned ugly face.",Collectible,$0 ,$0 ,$0 ,70
Tin Can ,909,"An empty tin can with a rusty edge, perfect for storing leftovers or throwing at local wildlife.",Other,$0 ,$1 ,$229 ,"2,583,378"
Betting Slip ,910,"This commemorative betting slip was given to members of the bookie team, whose years of manual bets and inputs came to an end when they were replaced by machines who worked harder and complained less.",Collectible,$0 ,$0 ,$0 ,51
Fidget Spinner ,911,"A popular craze back in 2017, Fidget Spinners were invented by Steve Fidget and Steve Spinner in 1992 as a way of distracting children's fingers from the exotic lure of plug sockets. This one was awarded to Jammed, and is subsequently now broken and gunked up with mashed potatoes.",Collectible,$0 ,$0 ,$0 ,20
Majestic Moose ,912,"At first glance, you may believe this Majestic Moose to be so named due to its magnificent set of antlers. You would be wrong. The majesty of this moose is evident through its personality, just like Forgey, who it was awarded to for being consistently majestic and protecting the Canadian border.",Collectible,$0 ,$0 ,$0 ,20
Lego Wonder Woman ,913,"Just like Poptop, this Lego Wonder Woman comes equipped with Dual Ban Hammers and a plastic personality. Unlike Poptop, this figurine poses a choking hazard to children aged 3 and under.",Collectible,$0 ,$0 ,$0 ,20
CR7 Doll ,914,"Awarded to Tiller in recognition of his speed, skill and magnificent thighs. Unfortunately, the doll can only be viewed from the back, as the face looks nothing like him.",Collectible,$0 ,$0 ,$0 ,20
Stretch Armstrong Doll ,915,"This Stretch Armstrong doll is made of plastic, rubber and filled with a non-toxic gel. It was awarded to staff member Stretch, who is made of skin, bones and filled with a highly toxic substance known as alcohol.",Collectible,$0 ,$0 ,$0 ,20
Beef Femur ,916,"After a hard day's staffing, 787thWarDog loves nothing more than to kick back and relax by chewing on a 10lb beef femur. Now you know why his coat is so glossy.",Collectible,$0 ,$0 ,$0 ,20
Snake's Fang ,917,"Filled with enough venom to kill a whale or 4,000 puppies, this snake's fang was originally implanted into the mouth of staff member Dexter. Sadly, he had to have it removed after accidentally biting his own tongue.",Collectible,$0 ,$0 ,$0 ,20
Icey Igloo ,918,"As Torn City's resident data wrangler, IceBlueFire often becomes overheated due to the heavy server loads running through his brain. As such, he must live inside an igloo, like this one, except bigger.",Collectible,$0 ,$0 ,$0 ,20
Federal Jail Key ,919,"Honourable people are often awarded the key to the city. Instead, Porny has been given the key to the federal jail, to commemorate his efforts in ridding Torn of dishonorable scumbags.",Collectible,$0 ,$0 ,$0 ,20
Halloween Basket : Spooky ,920,"This Spooky Halloween basket can be used to pilfer sweets, booze and energy drinks from your fellow citizens. It is made from 100% Vinyl Chloride, a carcinogen which is known to leech toxic chemicals into liquids and foodstuffs.",Special,$35 ,$0 ,$0 ,"12,377"
Michael Myers Mask '18 ,921,"Originally based on the face of William Shatner, this iconic mask was most famously worn by the villain of the Halloween movies, Michael Myers; a fictional murderer not to be confused with the real life guy who played Shrek.",Clothing,$0 ,$0 ,$0 ,250
Toast Jesus '18 ,922,"This piece of toast has been burnt in such a way that it seems to depict the face of the Son of God. What a glorious miracle! This year, rather than turkey, why not consume our Lord and Savioury Jesus Christ on Christmas Day instead?",Collectible,$0 ,$0 ,$0 ,50
Cheesus '18 ,923,"Forget Edam and Eve. They are nacho saviours. They will not boursin for you. But this Jesus-shaped Cheeto will. For this man is the Son of Gouda, Cheesus Christ. Camembert witness to his glorious legacy. Halloumi brie thy name.",Collectible,$0 ,$0 ,$0 ,52
Bottle of Christmas Spirit ,924,"This Bottle of Christmas Spirit is guaranteed to get you in the mood to tell your relatives what you really think of them. Replete with flavours of pine, candy and turkey, this booze will leave you feeling so full you'll barely suffer a hangover at all. Provides a very large nerve increase when consumed.",Alcohol,$0 ,$0 ,"$1,415,494 ","18,407"
Scammer in the Slammer '18 ,925,"You've heard of Elf on the Shelf, well here comes Scammer in the Slammer! This 100% asbestos toy can be used to watch over your family and friends to prevent them from selling Snowboards as Skateboards and Vicodin for Xanax. Zachjuv, Perplex and Kapten beware, the Scammer in the Slammer is watching you!",Collectible,$0 ,$0 ,$0 ,50
Gronch Mask '18 ,926,"Say hello to everyone's favourite festive villain, The Gronch! Legally distinct from other similar looking children's characters, The Gronch hates Christmas so much he'll knife anyone wearing an Xmas sweater. And now you too can follow in his bloody snowprints, by sporting this definitely non-copyright infringing Gronch Mask!",Clothing,$0 ,$0 ,$0 ,50
Baseball Cap ,927,"Wear it forwards to keep your head cool, wear it backwards to be even cooler.",Clothing,$0 ,$0 ,$698 ,"910,304"
Bermudas ,928,Some say these are named 'bermudas' because it's so easy to get lost in 'em.,Clothing,$0 ,$0 ,$201 ,"756,304"
Blouse ,929,"A lovely, flattering garment for warmer days.",Clothing,$0 ,$0 ,$202 ,"1,041,572"
Boob Tube ,930,"The best choice of clothing, if you want to spend all day hoisting something up.",Clothing,$0 ,$0 ,$780 ,"846,448"
Bush Hat ,931,It's said the mere presence of this hat makes crocs flee on sight.,Clothing,$0 ,$0 ,"$31,191 ","29,570"
Camisole ,932,This versatile undershirt can be worn on its own to add some flirty flavor.,Clothing,$0 ,$0 ,$203 ,"669,574"
Capri Pants ,933,Having a great shin day? Show them off with these pants.,Clothing,$0 ,$0 ,$203 ,"713,263"
Cardigan ,934,"For days that are neither hot nor cold, or when you don't want people to look at your butt.",Clothing,$0 ,$0 ,$272 ,"514,081"
Cork Hat ,935,"If you turn your head really fast, maybe you'll make some awesome music! Warning: this injures the eyes.",Clothing,$0 ,$0 ,$588 ,"566,216"
Crop Top ,936,"For whatever reason, you might decide that everyone needs to intimately get to know your gut. Wear this.",Clothing,$0 ,$0 ,"$3,999 ","76,455"
Fisherman Hat ,937,"Also known as a sou'wester or a bucket hat, the fisherman's hat is identified by its wide brim, chin strap, water-resistant finish, and mild scenting of halibut. The brim helps to keep sun from the wearer's eyes, whereas the chin strap prevents the hat from blowing into the water during heavy ocean gales. The waxy, waterproof coating on this piece of headwear is essential, as it stops it from becoming waterlogged while at sea. The fishy smell is optional, but has the added benefit of keeping friends and lovers at bay.",Clothing,$0 ,$0 ,"$5,233 ","51,157"
Gym Shorts ,938,"You don't just have to wear these to the gym, you can wear them anywhere you want! Isn't that cool?",Clothing,$0 ,$0 ,$255 ,"1,024,478"
Halterneck ,939,"What, you're too good for sleeves?",Clothing,$0 ,$0 ,$292 ,"472,446"
Raincoat ,940,"Contrary to popular belief, this coat was invented to protect from rain, not create it.",Clothing,$0 ,$0 ,"$13,501 ","50,446"
Pantyhose ,941,Wear this on your face for a stylish accessory to your robbery.,Clothing,$0 ,$0 ,$197 ,"1,491,383"
Pencil Skirt ,942,Is it a pencil? Is it a skirt? It's actually neither. (Except it's a skirt.),Clothing,$0 ,$0 ,$201 ,"1,019,131"
Peplum Top ,943,This shirt was designed as a dress for people who still wanted to wear pants.,Clothing,$0 ,$0 ,$202 ,"792,377"
Polo Shirt ,944,This casual sports shirt is sure to make people think you're a pretty cool guy.,Clothing,$0 ,$0 ,$202 ,"1,008,230"
Poncho ,945,This stylish must-have is the perfect combination of airy and warm.,Clothing,$0 ,$0 ,"$110,154 ","13,319"
Puffer Vest ,946,This handsome and authoritative vest is said to get people to respect your opinions 33% more. It also keeps your torso super warm!,Clothing,$0 ,$0 ,$217 ,"848,013"
Mackintosh ,947,"Legally, you are still supposed to wear clothes underneath this. But this is Torn, so you do you.",Clothing,$0 ,$0 ,"$14,936 ","36,824"
Shorts ,948,"Like pants, but less.",Clothing,$0 ,$0 ,$201 ,"947,259"
Skirt ,949,It's like a lampshade for people.,Clothing,$0 ,$0 ,$526 ,"740,236"
Travel Socks ,950,Keep your toes as warm and snuggly as your favourite handgun with these cozy travel socks.,Clothing,$0 ,$0 ,$252 ,"613,091"
Turtleneck ,951,This garment provides a handy built-in escape from awkward conversations.,Clothing,$0 ,$0 ,$218 ,"827,096"
Yoga Pants ,952,"Wear these if you want to do yoga, or if you want to remind people that you have a butt.",Clothing,$0 ,$0 ,$432 ,"688,045"
Bronze Racing Trophy ,953,"This Bronze Racing Trophy is awarded to those who finish third in racing events. Finishing third is probably worse than finishing fourth, as not only did you not win, but you've been recognised for your failure to achieve even a runner-up spot.",Collectible,$0 ,$0 ,$0 ,15
Silver Racing Trophy ,954,"This Silver Racing Trophy is awarded to those who finish second in racing events. Having been so close to victory, this trophy is here to remind you of the glory you failed to achieve. May its presence forever haunt you.",Collectible,$0 ,$0 ,$0 ,15
Gold Racing Trophy ,955,"This Gold Racing Trophy is awarded to the winner of a Torn racing event. Ownership of this item marks you out as a true champion - unless you bought it, in which case you are quite possibly the biggest loser of all.",Collectible,$0 ,$0 ,$0 ,15
Blank DVDs ,956,"This spindle pack of 250 writable DVD-R DVDs are suitable for video and data applications, and compatible with a variety of different drives.",Material,$80 ,$45 ,$617 ,"15,158,741"
Blank DVDs : 50 ,957,"This spindle pack of 50 writable DVD-R DVDs are suitable for video and data applications, and compatible with a variety of different drives.",Material,$20 ,$10 ,$0 ,0
Chest Harness ,958,"If you can ever figure out how to get this thing on, you'll be the belle of the leather fetish ball.",Clothing,$0 ,$0 ,"$898,500 ","2,594"
Choker ,959,"Despite its name, this flattering neck accessory is surprisingly comfortable.",Clothing,$0 ,$0 ,$0 ,"2,593"
Fishnet Stockings ,960,"Aside from the occasional fish caught in them, this steamy alternative to pantyhose remains a fan favourite.",Clothing,$0 ,$0 ,$0 ,"2,638"
Knee-high Boots ,961,"If you were to wear these and enter a 'highest boots' competition, you would only lose out to thigh-highs.",Clothing,$0 ,$0 ,"$989,990 ","2,556"
Lingerie ,962,It's really just a fancy word for underoos.,Clothing,$0 ,$0 ,"$3,950,000 ","2,589"
Mankini ,963,"Wear a mankini, but make sure you manscape first. Don't make me mansplain it to you.",Clothing,$0 ,$0 ,$0 ,353
Mini Skirt ,964,"The regular skirt's shorter, flirtier, smaller cousin.",Clothing,$0 ,$0 ,"$450,000 ","2,658"
Nipple Tassels ,965,Jump up and down so they go around and around and around and around!,Clothing,$0 ,$0 ,$0 ,718
Bowler Hat ,966,"Also known as a billycock, bob hat, bombin or derby, the Bowler Hat was once the preserve of city gentleman, being a key part of typical business attire until the 1970's. These days, Bowler Hats are exclusively worn by Dr Watson cosplayers and people going through a steampunk phase.",Clothing,$0 ,$0 ,"$553,000 ","3,000"
Fitted Shirt ,967,"Everyone looks good in a fitted white shirt. With extra tailoring applied around the chest and waist area, it will enable you to show off your pecks, bosoms or man-boobs in all their spectacular glory. Just don't spill gravy on it.",Clothing,$0 ,$0 ,"$3,399,999 ","2,828"
Bow Tie ,968,"If you're attending a fancy dinner and want to look smart, or you want to dress like a 12-year-old chess prodigy whose parents pushed him so hard he is unable to form meaningful friendships in adulthood, the Bow Tie is the perfect accessory. This one is made from red silk, and should be paired with a red pocket square and a smug, condescending outlook toward your peers.",Clothing,$0 ,$0 ,$0 ,"2,880"
